{
  "schema_version": "concordance-rule3-recovery-lock-1.0.0",
  "status": "immutable-successor-recovery-lock-no-spending-authorized",
  "recovery_id": "cohere-v2-model-id-1",
  "pool_id": "concordance-divergence-supplement-1",
  "rule_version": "pilot-rule-3",
  "candidate_id": "galatians-pistis-christou",
  "phase": "priority",
  "private_root": ".pilot/concordance-recovery/cohere-v2-model-id-1",
  "bindings": {
    "lock_schema": {
      "path": "candidate/concordance-recovery-lock.schema.json",
      "sha256": "7b74cc3dc9c6ab8e729761a132fb8b94c6e4a367a380c713cc6b6e7f332d0a87"
    },
    "parent_lock": {
      "path": "candidate/rule3-lock.json",
      "sha256": "8f4daf2ae53d07c7c53fc3f38d3ccd11aa18420185db632467fc9c280be523cc"
    }
  },
  "parent": {
    "git_head": "3f77bf7456a94d18fe2d0d0780a8d0602b4b486b",
    "lock_schema_version": "rule3-lock-1.0.0",
    "lock_sha256": "8f4daf2ae53d07c7c53fc3f38d3ccd11aa18420185db632467fc9c280be523cc",
    "priority_plan_sha256": "c1cdda59dcda1331344a8bc10188913dfcaa06a62f74cc3344fe1f2edb5f6c94",
    "public_bound_path_count": 34,
    "public_bound_paths_sha256": "955f43d16bc6e878020e9e98858602c2974bc88e6ce5c08a7f0aa2a36717d08c",
    "private_root": ".pilot/rule3/concordance-divergence-supplement-1",
    "private_bindings": [
      {
        "path": "budget/intents/galatians-pistis-christou/claude/attempt-1.json",
        "sha256": "bfb84f1367209b52b1490459d1a1ab079fab15ca5a5059177002372ca5a78101"
      },
      {
        "path": "budget/intents/galatians-pistis-christou/cohere/attempt-1.json",
        "sha256": "ee2b4d0b0c3ae1eaa0ea694f6ae04b158766012e9d6fec6ba938f7f352182bb9"
      },
      {
        "path": "budget/intents/galatians-pistis-christou/gemini/attempt-1.json",
        "sha256": "c1a828b4be8d8909ce23d64f7128b85b176f020f1f564418d07b7454daaf128c"
      },
      {
        "path": "manifests/galatians-pistis-christou.json",
        "sha256": "7dedec143467eebd3e489515cdb23686bd011aa5ae663999a5bc9ceafc37c135"
      },
      {
        "path": "outcomes/galatians-pistis-christou/claude/attempt-1.json",
        "sha256": "30d1481e3cd12946dcfede4e15984ed2fa3969aeff41e12af2666dafc833f41b"
      },
      {
        "path": "outcomes/galatians-pistis-christou/gemini/attempt-1.json",
        "sha256": "dc0a96587db718f2014f6e17631447dbafa6970ff5e379f1f29965c63f0dc0e1"
      },
      {
        "path": "paid-authorization.json",
        "sha256": "30ecdca710d05786bff0b07f632d9208016a605983078d30d27f9547dc5186c1"
      },
      {
        "path": "preflight/intents/galatians-pistis-christou/claude/attempt-1.json",
        "sha256": "a2e7d2de1d8b6b05c19362a07f78f58448d868e949d329592605f138b66acb4a"
      },
      {
        "path": "preflight/intents/galatians-pistis-christou/cohere/attempt-1.json",
        "sha256": "f132e2061486d7c38a11aef170026a16873daf9191aee6638c083b269bc60b7c"
      },
      {
        "path": "preflight/intents/galatians-pistis-christou/deepseek/attempt-1.json",
        "sha256": "507f9ae5a5061c2beef4d969cc9f4093b1d5f9000fa95f6d75a4ffc59349fcd4"
      },
      {
        "path": "preflight/intents/galatians-pistis-christou/gemini/attempt-1.json",
        "sha256": "289c13ea0c0128401a07095bb339be490cac91805784fbeedbaf11a799dfbb4c"
      },
      {
        "path": "preflight/intents/galatians-pistis-christou/gpt/attempt-1.json",
        "sha256": "564288ff9cf8a3a3a5aae789cfc71c783b7780c293dfcf744509109cec35548c"
      },
      {
        "path": "preflight/intents/galatians-pistis-christou/grok/attempt-1.json",
        "sha256": "665df8d9f8ef0bd3114ce31b8359ce46c1f7e7cdf3d18210a207c5f7d1cd3569"
      },
      {
        "path": "preflight/intents/galatians-pistis-christou/mistral/attempt-1.json",
        "sha256": "34c0bb2c81f5b3d6dd73f915fe6ded905c006356d81a5df0713be5c5d661301a"
      },
      {
        "path": "preflight/intents/galatians-pistis-christou/qwen/attempt-1.json",
        "sha256": "d10e4690fa59a7b6540dc0633994e237cfe3e4184373af25b5b63bf3635b78a8"
      },
      {
        "path": "preflight/outcomes/galatians-pistis-christou/claude/attempt-1.json",
        "sha256": "ed1d59ca52451a231f9c5347c94426e40af5ea2e5ed69253e9b55e3b8ff73f26"
      },
      {
        "path": "preflight/outcomes/galatians-pistis-christou/cohere/attempt-1.json",
        "sha256": "c31894629d425b5036236091656830000da4a692ee130078ad86cb802426064e"
      },
      {
        "path": "preflight/outcomes/galatians-pistis-christou/deepseek/attempt-1.json",
        "sha256": "8a7b3ef5ef88e23deddbbc12807f08e79a48d667bb263e39343939441bd1fcec"
      },
      {
        "path": "preflight/outcomes/galatians-pistis-christou/gemini/attempt-1.json",
        "sha256": "12abb1eaa6e7e40db42d6a16d6a732f1137a8f08275b20e6895264eccac1b4e9"
      },
      {
        "path": "preflight/outcomes/galatians-pistis-christou/gpt/attempt-1.json",
        "sha256": "4ee748319a84be5c9d35e65d1abc3e8332b511774cb2667661479d03aa13eda5"
      },
      {
        "path": "preflight/outcomes/galatians-pistis-christou/grok/attempt-1.json",
        "sha256": "f8d56a543c7344fb4e174f7c13286b0190388d248b098ba8406ae2b8ab6d52d9"
      },
      {
        "path": "preflight/outcomes/galatians-pistis-christou/mistral/attempt-1.json",
        "sha256": "04e13ea8bda72092000a0a66c20539f6cf258883039c63b5aa3e754dbe327dab"
      },
      {
        "path": "preflight/outcomes/galatians-pistis-christou/qwen/attempt-1.json",
        "sha256": "8a04e394e0b5dc7c144935d45cf87c551e80b4de058eafb66eac79804d1ed534"
      },
      {
        "path": "pricing-evidence.json",
        "sha256": "918e7e904ad3ba13eeb077ec44d0cb34722f2ff9c11d24941d2da6e729cff49a"
      },
      {
        "path": "pricing-recheck.json",
        "sha256": "285d2624ac3f636e58a25646a1fd255266f9c6d6b03e1c13ba9d4294fbc79483"
      }
    ],
    "private_binding_count": 25,
    "private_receipts": {
      "paid_authorization": {
        "path": "paid-authorization.json",
        "sha256": "30ecdca710d05786bff0b07f632d9208016a605983078d30d27f9547dc5186c1"
      },
      "pricing_evidence": {
        "path": "pricing-evidence.json",
        "sha256": "918e7e904ad3ba13eeb077ec44d0cb34722f2ff9c11d24941d2da6e729cff49a"
      },
      "pricing_recheck": {
        "path": "pricing-recheck.json",
        "sha256": "285d2624ac3f636e58a25646a1fd255266f9c6d6b03e1c13ba9d4294fbc79483"
      },
      "model_manifest": {
        "path": "manifests/galatians-pistis-christou.json",
        "sha256": "7dedec143467eebd3e489515cdb23686bd011aa5ae663999a5bc9ceafc37c135"
      }
    },
    "private_inventory": {
      "preflight_intent_paths": [
        "preflight/intents/galatians-pistis-christou/gemini/attempt-1.json",
        "preflight/intents/galatians-pistis-christou/claude/attempt-1.json",
        "preflight/intents/galatians-pistis-christou/cohere/attempt-1.json",
        "preflight/intents/galatians-pistis-christou/qwen/attempt-1.json",
        "preflight/intents/galatians-pistis-christou/deepseek/attempt-1.json",
        "preflight/intents/galatians-pistis-christou/mistral/attempt-1.json",
        "preflight/intents/galatians-pistis-christou/grok/attempt-1.json",
        "preflight/intents/galatians-pistis-christou/gpt/attempt-1.json"
      ],
      "preflight_outcome_paths": [
        "preflight/outcomes/galatians-pistis-christou/gemini/attempt-1.json",
        "preflight/outcomes/galatians-pistis-christou/claude/attempt-1.json",
        "preflight/outcomes/galatians-pistis-christou/cohere/attempt-1.json",
        "preflight/outcomes/galatians-pistis-christou/qwen/attempt-1.json",
        "preflight/outcomes/galatians-pistis-christou/deepseek/attempt-1.json",
        "preflight/outcomes/galatians-pistis-christou/mistral/attempt-1.json",
        "preflight/outcomes/galatians-pistis-christou/grok/attempt-1.json",
        "preflight/outcomes/galatians-pistis-christou/gpt/attempt-1.json"
      ],
      "generation_intent_paths": [
        "budget/intents/galatians-pistis-christou/gemini/attempt-1.json",
        "budget/intents/galatians-pistis-christou/claude/attempt-1.json",
        "budget/intents/galatians-pistis-christou/cohere/attempt-1.json"
      ],
      "generation_outcome_paths": [
        "outcomes/galatians-pistis-christou/gemini/attempt-1.json",
        "outcomes/galatians-pistis-christou/claude/attempt-1.json"
      ],
      "required_absent_before_recovery": [
        "outcomes/galatians-pistis-christou/cohere/attempt-1.json",
        "runs/galatians-pistis-christou.json"
      ],
      "concurrency_lock_paths": [
        "budget/.reservation.lock",
        "execution-locks/galatians-pistis-christou.lock"
      ],
      "exact_complete_parent_tree_required": true,
      "untouched_generation_model_keys": [
        "qwen",
        "deepseek",
        "mistral",
        "grok",
        "gpt"
      ],
      "untouched_generation_state_required_absent": true
    }
  },
  "defect": {
    "code": "cohere-v2-generation-model-id-absent-validator-mismatch",
    "durable_state": "generation-intent-without-usable-outcome",
    "provider_response_text_recovered": false,
    "original_intent_may_have_reached_provider": true,
    "original_intent_must_never_be_replayed": true,
    "recovery_rule": "one-authorized-semantic-attempt-two-replacement"
  },
  "preserved_successes": [
    {
      "model_key": "gemini",
      "intent_path": "budget/intents/galatians-pistis-christou/gemini/attempt-1.json",
      "intent_sha256": "c1a828b4be8d8909ce23d64f7128b85b176f020f1f564418d07b7454daaf128c",
      "outcome_path": "outcomes/galatians-pistis-christou/gemini/attempt-1.json",
      "outcome_sha256": "dc0a96587db718f2014f6e17631447dbafa6970ff5e379f1f29965c63f0dc0e1",
      "response_sha256": "e28a4290cd45152287bc415368cbefff4e6dca9e33d429a86fabd37c8b68de0e",
      "semantic_attempt_number": 1,
      "reserved_cost_microdollars": 197012,
      "actual_estimate_microdollars": 34676
    },
    {
      "model_key": "claude",